input_text,output_text
"My dog is excessively thirsty and urinating a lot, but also seems very tired and isn't eating well.","Increased thirst and urination can occur with Addison's disease due to electrolyte imbalances. This warrants a vet visit for blood work to check sodium and potassium levels."
"My dog is trembling or shaking, seems disoriented, and has abdominal pain.","Tremors and abdominal pain can be signs of electrolyte abnormalities (like high potassium, low sodium) and general malaise caused by Addison's disease. Seek immediate veterinary attention."
"My dog is showing depression, a loss of appetite, and has lost weight without a change in diet.","These are common, non-specific symptoms that can indicate chronic Addison's disease. A vet visit is needed for diagnostic testing to rule out or confirm the condition."
"My dog's vomit contains blood or his stool is black and tarry.","Gastrointestinal bleeding can occur in severe Addisonian crisis. This is a medical emergency. Seek immediate veterinary care."
"My dog seems to crave salt, licking at salty objects or dirt.","A salt craving can be a subtle sign of aldosterone deficiency in Addison's disease, as the body tries to retain sodium. This warrants a vet visit."
"My dog, who was recently tapered off long-term steroid medication, suddenly became very ill with vomiting and weakness.","Abrupt withdrawal of long-term steroids can cause a temporary (iatrogenic) Addisonian crisis. This is a medical emergency requiring immediate vet care and proper steroid re-introduction."
"My dog is experiencing muscle weakness and seems reluctant to jump or climb.","Muscle weakness can be a symptom of electrolyte imbalances caused by Addison's disease. A vet can perform blood tests to check electrolytes and diagnose."
"My dog has a slow heart rate (bradycardia) when examined by the vet, along with other vague sickness signs.","A slow heart rate can be a critical sign of high potassium levels in Addison's disease, which can affect heart function. Immediate veterinary attention is needed."
"My dog has been diagnosed with kidney issues, but his symptoms (vomiting, lethargy) don't fully fit typical kidney disease.","Addison's disease can mimic kidney failure, especially due to electrolyte imbalances. Specific tests are needed to differentiate between them. Inform your vet of all symptoms."
"My dog is having seizures or appears confused, along with vomiting and weakness.","Severe electrolyte imbalances or low blood sugar (hypoglycemia) in an Addisonian crisis can lead to neurological signs like seizures or confusion. This is a medical emergency. Rush to the vet."
"My dog's skin has areas of darkened pigmentation, especially in areas of friction or pressure points.","While less common and typically a chronic sign, hyperpigmentation can be associated with some forms of Addison's disease. This, combined with other symptoms, warrants a vet visit."
"My dog, typically energetic, is suddenly very subdued, refusing walks, and generally seems 'off'.","A sudden and significant drop in energy levels, especially if accompanied by gastrointestinal upset, should prompt a vet visit for comprehensive assessment."
"My dog is shivering even when it's not cold, and seems generally unwell with digestive upset.","Shivering can be a non-specific sign of discomfort or metabolic disturbance in Addison's disease. If accompanied by GI signs, a vet check is needed."
"My dog developed severe illness following a stressful event like boarding, travel, or surgery.","Stress can trigger an Addisonian crisis in dogs with underlying Addison's disease because their bodies cannot produce enough cortisol to cope. This is a medical emergency."
"My dog has unexplained weight loss over several months, with intermittent bouts of vomiting.","Chronic, unexplained weight loss, even with fluctuating symptoms, is a red flag for Addison's disease. A vet can conduct a thorough diagnostic workup."
"My dog was just diagnosed with Addison's disease after a crisis. What is the long-term outlook?","With proper, lifelong treatment (usually a monthly injection and daily oral steroid), dogs with Addison's disease have an excellent prognosis and can live full, normal lives. Regular vet check-ups are crucial to monitor hormone and electrolyte levels."
"My dog is drinking an excessive amount of water and urinating much more frequently, often having accidents.","These are hallmark early signs of Cushing's Disease. A vet visit is recommended for diagnostic tests to measure cortisol levels."
"My dog's appetite has increased dramatically, and he seems constantly hungry, even after meals.","Increased appetite (polyphagia) is a very common symptom of Cushing's Disease. This warrants a vet visit to investigate endocrine causes."
"My dog's belly looks enlarged or pot-bellied, and his back seems to sag.","A 'pot-belly' appearance is a classic sign of Cushing's Disease due to fat redistribution and weakened abdominal muscles. A vet can diagnose this."
"My dog is losing hair, especially on his body and flanks, but his head and legs still have fur.","Symmetrical hair loss on the body, often sparing the head and limbs, is a common dermatological symptom of Cushing's Disease. A vet can diagnose and manage."
"My dog's skin seems very thin and fragile, and bruises easily, with dark spots appearing.","Thin, fragile skin, prominent veins, and hyperpigmentation are common skin changes in Cushing's Disease. This warrants a vet visit for diagnosis."
"My dog is panting excessively, even when resting or in cool environments.","Excessive panting (polypnea) is a frequent symptom of Cushing's Disease due to muscle weakness and metabolic changes. A vet can assess and confirm."
"My dog seems very lethargic, weak, and has reduced stamina during walks or playtime.","Muscle weakness and decreased energy are common with Cushing's Disease. This should prompt a vet visit for comprehensive testing."
"My dog is developing recurrent skin infections or slow-healing wounds.","Excess cortisol weakens the immune system, making dogs with Cushing's Disease prone to secondary infections and impaired wound healing. A vet needs to address both the infection and the underlying hormonal issue."
"My dog has developed firm, calcified lumps or plaques on his skin, especially on his back or abdomen.","These are calcified skin lesions (calcinosis cutis), a severe but specific symptom of Cushing's Disease. This needs immediate veterinary attention for diagnosis and management."
"My dog's muscles seem to be wasting away, especially in the hind legs, making him weak.","Muscle atrophy, particularly in the hindquarters, contributes to weakness and is a common sign of Cushing's Disease. A vet can assess this."
"My dog has developed diabetes (high blood sugar) alongside other symptoms like increased thirst and appetite.","Cushing's Disease can cause insulin resistance, leading to secondary diabetes. If both are present, a vet needs to manage both conditions."
"My dog seems restless at night, pacing or having difficulty settling down to sleep.","Behavioral changes, including nocturnal restlessness, can be associated with Cushing's Disease. This warrants a vet visit to investigate."
"My dog is developing a noticeable 'double chin' or fat pads on his neck and shoulders.","Fat redistribution, including fat accumulation in these areas, can be a subtle sign of Cushing's Disease. A vet can confirm."
"My dog has a poor quality coat, even though I brush him regularly, and it feels coarse.","A dry, brittle, or unkempt coat is a common dermatological sign. A vet can perform tests to check for Cushing's."
"My dog is experiencing recurrent urinary tract infections that are difficult to clear.","The immunosuppressive effects of excess cortisol make dogs with Cushing's Disease prone to chronic UTIs. A vet needs to treat the infection and address the underlying Cushing's."
"My dog is showing signs of neurological changes, like circling, head pressing, or behavioral shifts.","While less common, some pituitary tumors can grow large enough to cause neurological signs. This requires immediate veterinary assessment and possibly advanced imaging."
"My dog's personality seems different; he's less playful, more withdrawn, or occasionally irritable.","Subtle behavioral changes can occur with chronic illness like Cushing's Disease. If combined with physical symptoms, a vet can assess."
"My senior dog has multiple health issues, including dental problems, and seems to be aging rapidly.","Cushing's Disease can worsen or mimic signs of aging. A comprehensive vet workup is needed to differentiate and manage multiple conditions."
"My dog has thickened, crusty elbows or calluses that don't seem to heal.","Skin changes, including non-healing calluses, can be related to the thin, fragile skin and altered metabolism in Cushing's Disease. A vet can provide treatment."
"My dog was recently put on long-term steroid medication, and now has increased thirst and appetite.","These are common side effects of steroid medication (iatrogenic Cushing's). Consult your veterinarian, who may adjust the dose or explore alternative treatments, rather than stopping medication abruptly."
"My large, deep-chested dog's abdomen is suddenly very distended and hard, like a drum.","This is a classic and critical sign of Bloat (GDV). This is a **medical emergency**. Rush your dog to the nearest emergency veterinarian immediately."
"My dog is trying to vomit or retch repeatedly, but nothing is coming up, or just foamy saliva.","Unproductive retching is a hallmark symptom of Bloat (GDV). This means the stomach is blocked. Seek immediate emergency veterinary attention without delay."
"My dog seems extremely restless, pacing, whining, and unable to get comfortable.","Sudden, severe restlessness and discomfort are common early signs of Bloat (GDV) due to intense abdominal pain. Seek immediate emergency veterinary care."
"My dog collapsed, is very weak, and her gums are pale, after showing signs of abdominal discomfort.","These are signs of shock, a severe complication of Bloat (GDV). This is a **life-threatening emergency**. Rush your dog to the nearest emergency veterinarian immediately."
"My dog is panting excessively, breathing rapidly and shallowly, and his abdomen looks swollen.","Rapid, shallow breathing indicates pain and pressure on the diaphragm from Bloat (GDV). This is critical. Seek immediate emergency veterinary attention."
"My dog's heart rate seems very fast, and his pulse feels weak, along with a distended abdomen.","Tachycardia and a weak pulse are signs of shock in Bloat (GDV). This requires immediate emergency veterinary intervention."
"My dog is drooling excessively and seems to be in a lot of pain, continuously looking at his side.","Excessive drooling can be a sign of severe nausea and discomfort in Bloat (GDV). The intense pain warrants immediate veterinary attention."
"My dog's abdomen feels tight and tender to the touch, and he's grunting or groaning.","Abdominal tenderness and vocalization due to pain are strong indicators of Bloat (GDV). Do not try to press on the abdomen. Seek immediate emergency veterinary care."
"My dog had a large meal and lots of water, and now his stomach is very bloated and he's trying to vomit.","Recent large meals followed by intense activity or water intake can be a trigger for Bloat (GDV). The combination of bloat and unproductive retching is a critical emergency. Get to the vet immediately."
"My dog is very anxious, agitated, and seems unable to lie down or find a comfortable position.","Extreme anxiety and inability to rest are common behavioral signs of the severe pain and discomfort from Bloat (GDV). This is an urgent symptom."
"My dog's attempts to vomit sound strained and painful, and he's clearly in distress.","The straining and obvious distress indicate a serious blockage and pain. This is a critical symptom of Bloat (GDV). Seek immediate emergency veterinary attention."
"My dog's body temperature seems low, and his extremities feel cold, despite a swollen belly.","Hypothermia can occur due to shock in severe Bloat (GDV). Keep your dog warm with blankets and rush to the emergency vet."
"My dog is showing signs of weakness in his hindquarters and seems unsteady on his feet, along with a bloated stomach.","Generalized weakness and ataxia can occur as blood flow is compromised in Bloat (GDV). This indicates a severe stage. Seek immediate emergency veterinary care."
"My dog suddenly developed a rounded, barrel-like appearance to his abdomen and seems short of breath.","The rapid change in abdominal shape and difficulty breathing are classic signs of Bloat (GDV). This is a medical emergency."
"My dog's gums are a dark red, then suddenly turn very pale.","Changes in gum color from congested (dark red) to pale are signs of severe circulatory compromise and shock in Bloat (GDV). This indicates extreme urgency."
"My dog had a recent episode of rapid eating or post-meal exercise, and now is restless and has a swollen abdomen.","These are potential risk factors and early warning signs for Bloat (GDV). Do not wait for unproductive retching to begin; if the abdomen is distended and dog is restless, go to the vet immediately."
"My dog is making grunting or whimpering noises continuously, and seems in agony.","Constant vocalization due to severe pain is a critical sign of Bloat (GDV). Immediate veterinary intervention is necessary for pain control and emergency surgery."
"My dog is trying to burp or pass gas, but nothing is happening, and his stomach is swelling.","Inability to relieve gas, along with abdominal distension, is a clear indicator of a twisted stomach in Bloat (GDV). This is an absolute emergency."
"My dog is lying down rigidly, won't move, and has a very taut, distended belly.","Rigidity and refusal to move suggest extreme pain and potentially an inability to stand due to the severe abdominal pressure from Bloat (GDV). This needs immediate emergency veterinary care."
"My dog is a Great Dane and suddenly has a distended, drum-like abdomen with unproductive retching.","Great Danes are among the highest risk breeds for Bloat (GDV). This combination of symptoms in a high-risk breed is a dire emergency. Every minute counts; seek immediate, life-saving veterinary intervention."
"My puppy has small patches of hair loss around his face and front legs, but they don't seem itchy.","This sounds like localized **Demodectic Mange**. It's common in puppies and often resolves as their immune system matures. A vet visit is recommended to confirm and monitor, as it can sometimes progress."
"My dog is scratching intensely all over his body, especially on his ears, elbows, and belly, and has red bumps.","This intense itching is a hallmark of **Sarcoptic Mange (Scabies)**. It's highly contagious to other dogs and can cause temporary itching in humans. Seek immediate veterinary attention for diagnosis and treatment."
"My dog has large, widespread areas of hair loss, crusty skin, and secondary bacterial infections, and she's an adult.","This is likely generalized **Demodectic Mange** in an adult dog. This often indicates an underlying immune system issue. A vet visit is crucial for diagnosis, long-term treatment, and to identify any other health problems."
"My dog's skin is red, flaky, and has scabs, especially on the hairless parts of his body, and he's constantly scratching.","These are classic signs of **Sarcoptic Mange**. The mites burrow into the skin, causing severe irritation. A vet needs to perform skin scrapings to confirm and start anti-mite medication."
"I found small, circular, hairless patches on my dog's body that are not red or itchy.","This is characteristic of localized **Demodectic Mange**. While often mild, a vet should confirm the diagnosis to differentiate from other skin conditions."
"My dog had contact with a stray dog, and now has sudden, severe itching and hair loss.","**Sarcoptic Mange** is highly contagious through direct contact. If there's a history of exposure and sudden, intense itching, it's highly suspected. Isolate your dog and see a vet immediately."
"My dog's skin has thickened, darkened, and become leathery in areas that she constantly scratches.","This thickening and darkening (lichenification and hyperpigmentation) are chronic changes seen in severe, long-standing **Sarcoptic Mange** due to constant scratching. Requires veterinary treatment."
"My dog has scabs and sores from scratching so much, and there's a bad odor coming from her skin.","Secondary bacterial skin infections are common with both types of mange, especially **Sarcoptic**, due to skin damage from scratching. A vet will need to treat both the mites and the infection (e.g., antibiotics, medicated shampoos)."
"My puppy had demodectic mange that resolved, but now it's returned with more widespread lesions.","Relapse or progression of **Demodectic Mange** in puppies can occur. A vet needs to assess if it's generalized and consider underlying immune system development."
"My dog is experiencing weight loss, lethargy, and decreased appetite along with severe skin issues.","Severe, widespread mange (especially generalized **Demodectic Mange** or chronic **Sarcoptic Mange**) can cause systemic illness due to infection, pain, and stress. This warrants immediate veterinary attention."
"My dog has crusty ear margins, especially on the tips, and is constantly shaking his head and scratching.","Crusts on the ear margins (pinnal-pedal reflex: rubbing the ear causes the dog to scratch with its hind leg) are a very strong indicator of **Sarcoptic Mange**. A vet can confirm and treat."
"My dog's skin feels greasy and he has a 'yeasty' smell, along with hair loss.","Secondary yeast infections can occur with mange, particularly **Demodectic Mange**, due to a compromised skin barrier. A vet will diagnose and prescribe antifungal treatment."
"My dog is pregnant or elderly and has sudden onset widespread hair loss without much itching.","Compromised immune systems (due to pregnancy, old age, or underlying illness) can trigger **Demodectic Mange**. A vet visit is crucial for diagnosis and careful treatment."
"My dog is scratching himself raw, and I've developed itchy red bumps on my arms and torso after handling him.","This strongly suggests **Sarcoptic Mange**, which is zoonotic (can transfer to humans). While the mites don't complete their life cycle on humans, they cause severe itching. Treat the dog and consult your doctor if symptoms persist."
"My dog has localized hair loss, and the skin appears reddish and scaly, but not inflamed or itchy.","Early localized **Demodectic Mange** often presents with just hair loss and scaling, without much itchiness. A skin scraping by a vet will confirm the presence of mites."
"My dog has been getting continuous steroid injections for allergies, and now has new patches of hair loss.","Steroids can suppress the immune system, potentially unmasking or worsening **Demodectic Mange**. A vet should re-evaluate the skin condition and medication."
"My dog is highly allergic to fleas, but her itching is different now, more constant and intense, especially at night.","If usual flea treatments aren't working and itching is severe and continuous, particularly if it worsens at night, **Sarcoptic Mange** should be suspected. A vet can perform specific tests."
"My dog was recently in a shelter or rescue, and now has patches of hair loss and skin irritation.","Dogs from high-density environments are at increased risk for both types of mange. A vet check is important for new rescues to rule out parasitic skin conditions."
"My dog has a 'moth-eaten' appearance to his coat, with small, irregular patches of hair loss.","This pattern of hair loss can be seen with **Demodectic Mange**. A vet can perform deep skin scrapings to look for mites."
"My dog was diagnosed with mange. What home remedies can I use?","While some anecdotal home remedies exist, **mange, especially Sarcoptic, requires veterinary diagnosis and prescription medication for effective treatment.** Home remedies are generally not sufficient and can delay proper care, leading to worsening of the condition and discomfort. Always consult your vet for a definitive diagnosis and treatment plan. For **Demodectic Mange**, the primary goal is often immune support or specific mite-killing medication. For **Sarcoptic Mange**, all dogs in the household usually need treatment, and environmental cleaning is important due to its contagiousness."
"My dog has developed a mild, persistent cough, especially after exercise.","This is often one of the first visible signs of Heartworm disease, particularly as the worms affect the lungs. A vet visit for a heartworm test is crucial, even if he's on preventative."
"My dog seems less energetic than usual and tires easily during walks or playtime.","Decreased stamina and lethargy can be subtle indicators of Heartworm disease affecting the heart and lungs. A vet can perform a physical exam and heartworm test."
"My dog is reluctant to exercise, even for short periods, and seems to pant more than usual.","Exercise intolerance and increased panting are common as heartworm disease progresses and affects lung capacity. A vet visit for testing is recommended."
"My dog has lost weight despite no change in diet or appetite.","Unexplained weight loss can occur in advanced Heartworm disease due to the body expending more energy to compensate for damaged heart/lungs. This warrants a vet visit."
"My dog's abdomen appears swollen or bloated, and his breathing seems labored.","Abdominal swelling (ascites) and labored breathing can indicate severe heart failure and fluid accumulation due to advanced Heartworm disease. This is a medical emergency. Seek immediate veterinary attention."
"My dog's cough is now more severe, and he sometimes coughs up blood.","Coughing up blood (hemoptysis) is a very serious symptom of advanced Heartworm disease affecting the lungs. This requires immediate veterinary attention."
"My dog has pale gums and seems very weak, almost collapsing.","These are signs of severe anemia or circulatory shock, possibly due to advanced Heartworm disease affecting blood flow. This is a medical emergency. Rush your dog to the nearest emergency veterinarian."
"My dog has a noticeable bulge on his chest or ribs, and his heart sounds loud.","A 'barrel-chested' appearance and abnormal heart sounds (detected by a vet) can indicate heart enlargement due to chronic Heartworm disease. A vet can perform X-rays and an echocardiogram."
"My dog, who is not on heartworm prevention, recently moved from a high-risk area and now seems generally unwell.","If not on prevention, dogs from areas with high mosquito populations are at very high risk. A vet visit for immediate testing is crucial, followed by prevention if negative or treatment if positive."
"My dog suddenly developed difficulty breathing, weakness, and dark urine.","This could indicate Caval Syndrome, a life-threatening complication where a mass of heartworms blocks blood flow in the heart. This is a dire emergency. Rush your dog to the nearest emergency veterinarian immediately."
"My dog is experiencing nosebleeds that are difficult to stop.","Chronic nosebleeds can be a less common but serious symptom of Heartworm disease, affecting blood clotting or pressure. A vet visit is necessary."
"My dog has developed a condition called 'glomerulonephritis' (kidney inflammation).","Heartworm disease can cause immune-mediated kidney damage. If your dog has kidney issues and a history of heartworm risk, a vet should test for heartworm."
"My dog has a history of allergies and a chronic cough, but it's gotten worse and he's more tired.","While allergies can cause a cough, a worsening cough and increased lethargy, especially with heartworm risk, warrant a heartworm test. A vet can differentiate."
"My dog seems to have a poor coat quality and is generally looking unthrifty.","Long-term illness like chronic Heartworm disease can affect overall health and coat condition. This, along with other subtle signs, should prompt a vet check-up."
"My dog has been diagnosed with heartworm disease. What are the treatment options?","Heartworm treatment is a complex, multi-step process involving specific injections to kill adult worms, often with pre-treatment antibiotics and steroids, strict rest, and ongoing prevention. It should only be done under strict veterinary supervision."
"My dog's abdomen feels full of fluid, and he has a chronic cough.","Fluid in the abdomen (ascites) combined with a chronic cough is a strong indicator of heart failure secondary to advanced Heartworm disease. This is a medical emergency requiring urgent vet care."
"My dog seems to be recovering from one illness, but then shows new symptoms like coughing and lethargy.","Heartworm disease can be insidious and sometimes diagnosed when investigating other seemingly unrelated issues, or symptoms emerge after stress. A heartworm test should be considered."
"My dog is showing signs of right-sided heart failure (fluid in abdomen/legs), but his lungs seem clear.","Heartworm primarily affects the right side of the heart, leading to fluid retention in the body (ascites, peripheral edema). This requires immediate veterinary intervention."
"My dog tested positive for heartworm. How soon does treatment need to begin?","Treatment should begin as soon as medically appropriate, usually after confirmatory tests and stabilization, to prevent further damage. Your vet will outline the specific timeline and plan based on the disease stage."
"I want to protect my dog from heartworms. What should I do?","Heartworm prevention is key! Start your dog on year-round, vet-prescribed heartworm preventative medication. Ensure an annual heartworm test before restarting prevention, especially if a dose was missed or you're in a high-risk area."
