input_text,output_text
"My dog has a high fever and is constantly sneezing.","Suspected Canine Influenza. Keep your dog warm and hydrated. Isolate from other dogs. Consult a veterinarian promptly."
"My dog is coughing frequently and seems very lethargic.","Possible Canine Flu. Ensure your dog gets plenty of rest and fluids. Watch for worsening symptoms and contact your vet."
"My dog has watery eyes and a runny nose, similar to a cold.","Canine Influenza is a possibility. Clean discharge gently. Encourage rest and fluid intake. Veterinary consultation is advised, especially for puppies or senior dogs."
"My dog is showing signs of nasal discharge and has a reduced appetite.","Likely Canine Flu. Offer small, palatable meals to encourage eating. Monitor for dehydration. Seek veterinary advice if symptoms persist or worsen."
"My dog is breathing heavily and has a persistent dry cough.","Could be Canine Influenza. Minimize physical activity. Ensure good air circulation. A vet can prescribe cough suppressants or other treatments."
"My dog seems tired all the time and is refusing to play or eat.","Suspected Canine Flu. Provide a quiet, comfortable resting place. Encourage fluid intake. A veterinary visit is crucial to confirm diagnosis and treatment."
"My dog's nose is dry and warm, and he's been snorting.","Canine Influenza could be present. Monitor temperature regularly. Keep your dog hydrated. Contact your vet for guidance."
"My dog has suddenly developed a cough and seems very sluggish.","Possible Canine Flu. Ensure quiet rest and access to fresh water. Avoid contact with other dogs. Veterinary assessment is recommended."
"My dog is weak, has a fever, and is shivering.","Likely Canine Influenza. Provide warmth and ensure hydration. Isolate your dog. Urgent vet consultation is advised."
"My dog is uninterested in food and has a slight cough.","Could be early signs of Canine Flu. Offer tempting foods like chicken broth. Monitor closely for worsening symptoms. Consult a vet if no improvement."
"My dog has a discharge from his eyes and seems generally unwell.","Canine Influenza is a possibility. Gently clean eye discharge. Ensure comfortable, warm surroundings. Veterinary advice is important for proper management."
"My dog is sneezing, has a slight fever, and seems to have less energy.","Suspected Canine Flu. Encourage rest and fluid intake. Observe for breathing difficulties. Consult a vet, especially if fever is high."
"My dog's appetite has decreased significantly and he's coughing.","Possible Canine Influenza. Try offering wet food or diluted broth. Ensure a calm environment. Veterinary guidance is essential."
"My dog is restless, coughing, and seems to have difficulty breathing.","Likely severe Canine Flu. Keep your dog calm. Seek immediate veterinary attention for respiratory distress."
"My dog is producing foamy discharge when he coughs.","Canine Influenza could be severe. Keep your dog hydrated and comfortable. Urgent veterinary consultation is necessary to assess lung involvement."
"My dog has a mild fever and sounds hoarse when barking.","Suspected Canine Flu. Monitor temperature and provide plenty of water. Vocal rest may be helpful. Vet visit is recommended."
"My dog is drooling more than usual and has a wet cough.","Possible Canine Influenza. Ensure easy access to water. Keep the area clean. Consult your vet to manage symptoms and prevent complications."
"My dog is lethargic and has a persistent cough that won't go away.","Likely Canine Flu. Provide a quiet, warm space. Ensure constant access to fresh water. A vet can provide appropriate treatment for a persistent cough."
"My dog has lost his sense of smell and isn't interested in food.","Canine Influenza might be affecting your dog. Offer strong-smelling foods. Monitor for dehydration. Veterinary consultation is advised."
"My dog seems generally ill, with nasal discharge and occasional sneezing.","Could be Canine Flu. Keep your dog comfortable and well-hydrated. Isolate from other pets. Veterinary check-up is recommended to confirm and treat."
"My dog has a sudden, harsh, dry cough that sounds like a goose honk.","Suspected Kennel Cough. Isolate your dog from other dogs. Provide warm, humid air (e.g., steamy bathroom). Keep them hydrated and comfortable. Consult a vet for diagnosis and possible medication."
"My dog keeps coughing, especially after exercise or excitement.","Likely Kennel Cough. Minimize strenuous activity. Ensure access to fresh water. Monitor for fever or lethargy. A vet can advise on cough suppressants or antibiotics if needed."
"My dog is gagging and seems like he's trying to clear his throat, but nothing comes out.","Possible Kennel Cough. This is a common symptom. Offer small, frequent meals if eating is difficult. Keep the environment calm. Veterinary check-up is recommended."
"My dog has a hacking cough and sometimes throws up white foam.","Could be Kennel Cough. This foamy vomit often results from persistent coughing. Ensure your dog stays hydrated. Consult a vet to rule out other conditions and for treatment."
"My dog seems otherwise fine, but has a persistent, dry cough.","Likely Kennel Cough. It often presents with minimal other symptoms. Keep your dog rested and hydrated. Monitor for fever or worsening symptoms. Vet consultation is a good idea."
"My dog is coughing a lot at night and it's disrupting his sleep.","Suspected Kennel Cough. Try a humidifier near their sleeping area. Ensure they have a comfortable, warm place to rest. A vet can prescribe medication to ease night coughing."
"My puppy has developed a harsh, hacking cough after being around other dogs.","Highly suggestive of Kennel Cough, especially if recently exposed. Isolate immediately. Keep well-hydrated. Puppies can be more vulnerable, so a vet visit is strongly advised."
"My dog's cough sounds like he has something stuck in his throat.","Common description for Kennel Cough. Offer soft food if the throat seems irritated. Avoid neck collars; use a harness. Consult a vet for proper diagnosis."
"My dog has a dry cough and is less energetic than usual.","Possible Kennel Cough. Ensure plenty of rest. Provide fresh water constantly. If lethargy increases or fever develops, contact your veterinarian."
"My dog starts coughing whenever he gets excited or pulls on his leash.","Likely Kennel Cough. Use a harness instead of a collar to avoid putting pressure on the trachea. Keep excitement levels low. Veterinary advice is recommended."
"My dog is coughing frequently and seems to have a slightly runny nose.","Could be Kennel Cough with mild secondary symptoms. Focus on rest and hydration. Keep discharge clean. A vet can assess the severity and prescribe treatment."
"My dog's cough is very persistent and sounds very raspy.","Suspected Kennel Cough. Avoid irritants like smoke or strong cleaners. Ensure quiet rest. Veterinary attention can help manage the persistent cough and prevent complications."
"My dog seems uncomfortable and keeps trying to clear his throat with a cough.","Likely Kennel Cough. Provide a calm environment. Ensure constant access to fresh water. A vet can confirm the diagnosis and suggest relief measures."
"My dog has a strong, sudden coughing fit, then seems fine for a bit.","Typical pattern for Kennel Cough. These fits can be alarming but usually resolve. Monitor for fever or respiratory distress. Vet consultation is advised for management."
"My dog is not eating much because of his coughing.","Possible Kennel Cough making eating difficult. Offer soft, palatable foods. Ensure hydration. A vet can provide anti-nausea or appetite stimulants if needed."
"My senior dog has developed a strong, dry cough.","Suspected Kennel Cough. Senior dogs can be more susceptible to complications. Ensure warmth and rest. Prompt veterinary consultation is crucial for managing symptoms and preventing pneumonia."
"My dog has a deep, unproductive cough that just won't stop.","Likely Kennel Cough. Encourage steam inhalation (e.g., from a shower). Limit exposure to cold air. A vet can provide effective treatment options."
"My dog sounds like he's choking or gagging, but no food is involved.","Very common presentation for Kennel Cough. Keep your dog calm. Ensure access to water. Veterinary assessment is important to differentiate from other causes."
"My dog is generally well but has an irritating cough that comes and goes.","Often Kennel Cough. Ensure good ventilation in their living area. Provide fresh water. Monitor for any worsening symptoms and consult a vet if it persists."
"My dog has a cough and seems to be rubbing his face more than usual.","Could be Kennel Cough with some nasal irritation. Gently clean any nasal discharge. Ensure your dog is comfortable and well-hydrated. A vet can confirm and advise."
"My dog has a high fever and is suddenly very lethargic after finding a tick on him.","Suspected Tick Fever. Immediately consult a veterinarian. Keep your dog calm and hydrated. Do not attempt to self-medicate."
"My dog's gums are pale, he's weak, and he refuses to eat. I recently removed a tick from him.","Possible Tick Fever. This could indicate anemia. Seek immediate veterinary attention for diagnosis and treatment, which may include blood tests and antibiotics."
"My dog has joint pain, is limping, and seems generally unwell, with no obvious injury.","Likely Tick Fever. Monitor for other symptoms like fever or loss of appetite. Urgent veterinary visit is necessary for proper diagnosis and specific medication."
"My dog is losing weight, has a nosebleed, and seems depressed.","Suspected Tick Fever, possibly affecting blood clotting. This requires immediate veterinary assessment and blood tests. Do not delay seeking professional help."
"My dog's lymph nodes feel swollen, and he's not as active as usual.","Possible Tick Fever. Check for any recent tick exposure. Contact your veterinarian for a full examination and diagnostic tests."
"My dog is vomiting and has diarrhea, and I've seen ticks in our yard recently.","Could be Tick Fever. Ensure your dog stays hydrated by offering small amounts of water frequently. Get to a vet as soon as possible for definitive diagnosis and supportive care."
"My dog seems to have difficulty breathing and has a persistent cough, along with general weakness.","Suspected Tick Fever with potential respiratory involvement. This is a serious symptom requiring immediate veterinary attention and emergency assessment."
"My dog's urine is dark or reddish-brown, and he's very weak.","Highly indicative of a severe form of Tick Fever (like Babesiosis). This is a medical emergency. Rush your dog to the nearest emergency vet immediately."
"My dog has purplish-red spots on his skin and gums, and seems to be bruising easily.","Strong signs of Tick Fever affecting platelets. This needs urgent veterinary care, including blood tests and possibly a blood transfusion."
"My dog is experiencing seizures and seems disoriented after being in a tick-prone area.","Possible neurological complications of Tick Fever. Seek immediate emergency veterinary attention. Keep your dog safe during seizures."
"My dog's spleen feels enlarged when I gently touch his abdomen, and he's feverish.","Suspected Tick Fever. Avoid deep palpation. Contact your veterinarian immediately for a professional examination and appropriate diagnostic imaging."
"My dog is showing signs of muscle pain and stiffness, especially in his hind legs.","Likely Tick Fever. While keeping him comfortable, arrange for a prompt veterinary appointment for diagnosis and specific treatment."
"My dog has a fluctuating fever that comes and goes, and seems to have a poor appetite.","Possible chronic Tick Fever. Continue to monitor temperature. It's crucial to consult a veterinarian for long-term management and specific antibiotics."
"My dog recently had a tick bite, and now he's shivering and appears very cold despite being indoors.","Suspected Tick Fever causing fever and chills. Provide warmth with blankets. Contact your vet to report symptoms and get guidance."
"My dog's eyes appear red and inflamed, and he has a discharge, along with general malaise.","Could be Tick Fever affecting the eyes. Gently clean around the eyes. Crucially, a vet visit is needed to address the underlying infection."
"My dog is extremely thirsty and seems to be urinating more than usual, after a known tick exposure.","Possible Tick Fever affecting kidney function. Ensure constant access to fresh water. Urgent veterinary assessment of kidney values is necessary."
"My dog has swollen paws or face, and seems very sensitive to touch.","Suspected Tick Fever causing inflammation. Avoid human pain medications. Consult a veterinarian immediately for anti-inflammatory treatment and diagnosis."
"My dog is reluctant to move, standing hunched, and seems to have abdominal pain.","Possible Tick Fever affecting internal organs. Do not try to palpate deeply. Immediate veterinary examination is crucial to determine the cause of the pain."
"My dog seems generally off, with no specific major symptoms, but I've found engorged ticks on him before.","Even vague symptoms warrant concern for Tick Fever if there's a history of ticks. Schedule a vet check-up, mentioning the tick history, for baseline blood tests."
"My dog is not responding to his usual treats and playtime, and has a noticeable loss of sparkle in his eyes.","Could be early, non-specific signs of Tick Fever. While supporting him with comfort, arrange a vet visit to discuss recent tick exposure and overall changes."
"My dog is constantly shaking his head and scratching his ears.","Suspected Ear Infection. Gently check the ear for redness or discharge. Keep the ear clean and dry. Consult a veterinarian for proper diagnosis and medicated ear drops."
"My dog's ear smells bad and has a dark, waxy discharge.","Likely Ear Infection. Do not use cotton swabs inside the ear canal. Clean the outer ear gently. A vet visit is crucial for diagnosis (yeast, bacteria, mites) and specific treatment."
"My dog cries out when I touch his ear, and it looks red and swollen.","Possible painful Ear Infection. Avoid touching the ear to prevent further pain. Seek immediate veterinary attention for pain relief and treatment."
"My dog is holding one ear down and seems unbalanced or tilted his head.","Suspected Ear Infection, possibly severe or affecting the inner ear. Keep your dog calm. A vet visit is urgent to prevent further complications like vertigo."
"My dog has a yellowish-green discharge coming from his ear.","Strongly suggests a bacterial Ear Infection. Do not self-treat. A veterinarian needs to assess and prescribe appropriate antibiotics."
"My dog has black, crusty debris in his ears, and they are very itchy.","Likely Ear Mites. Clean the outer ear gently. You'll need vet-prescribed medication (topical or oral) to eradicate the mites. Treat all pets in the household."
"My dog seems to be losing his hearing and his ears look dirty inside.","Could be a chronic Ear Infection or excessive wax build-up. A vet can perform an otoscopic exam and deep cleaning if necessary, along with medication."
"My dog's ear flap is thickened and swollen, like a hematoma.","Possible Ear Hematoma, often caused by vigorous head shaking due to an underlying ear infection. This requires immediate veterinary intervention, often surgical."
"My dog is rubbing his ear against furniture and the floor constantly.","Suspected Ear Infection causing intense itching. Check for any foreign objects or parasites. A vet visit is needed for proper diagnosis and relief."
"My dog is pacing, restless, and occasionally whimpers while shaking his head.","Possible painful Ear Infection. Try to keep your dog calm. Avoid any attempts to clean deep inside the ear. Seek veterinary care promptly for pain management and treatment."
"My dog has a red, inflamed rash inside his ear flap.","Likely Ear Infection or allergic reaction. Clean the outer ear with a gentle, pet-safe ear cleaner. A vet can determine the cause and prescribe appropriate medication."
"My dog recently went swimming and now his ears seem bothering him.","Possible 'Swimmer's Ear' (otitis externa). Gently dry the ear canals after swimming. If irritation persists or discharge appears, consult a vet to prevent infection."
"My dog's ear is hot to the touch and he's scratching it raw.","Suspected Ear Infection with inflammation. Prevent further self-trauma (e.g., e-collar). A vet can provide anti-inflammatory and anti-itch medication, along with infection treatment."
"My dog has small, raised bumps or pimples inside his ear.","Could be a skin infection or irritation within the ear. Avoid squeezing. A vet can properly diagnose and treat these skin lesions."
"My dog is tilting his head frequently and walking in circles.","Strongly suggests a severe Ear Infection, possibly affecting balance (vestibular system). Immediate veterinary attention is critical."
"My dog has a crusty buildup around the opening of his ear canal.","Possible Ear Infection or dermatitis around the ear. Clean the outer area gently with warm water. A vet can assess the ear canal and skin."
"My dog's ear smells sweet or yeasty and is very itchy.","Highly indicative of a Yeast Infection in the ear. Do not try to treat with human products. A vet will prescribe specific antifungal ear drops."
"My dog seems sensitive to loud noises and is shaking his head more than usual.","Could be an Ear Infection causing discomfort. Keep the environment quiet. A vet can check for infection and provide treatment."
"My dog's inner ear seems very greasy and oily, and it smells.","Likely a chronic Ear Infection or excessive sebaceous gland activity. Regular cleaning by a vet may be needed, along with medicated treatment."
"My dog has painful-looking scabs and hair loss around his ears.","Possible severe Ear Infection or allergic reaction leading to self-trauma. Prevent further scratching (e.g., e-collar). A vet can treat the underlying cause and the skin lesions."
"My dog is constantly shaking his head and scratching his ears.","Suspected Ear Infection. Gently check the ear for redness or discharge. Keep the ear clean and dry. Consult a veterinarian for proper diagnosis and medicated ear drops."
"My dog's ear smells bad and has a dark, waxy discharge.","Likely Ear Infection. Do not use cotton swabs inside the ear canal. Clean the outer ear gently. A vet visit is crucial for diagnosis (yeast, bacteria, mites) and specific treatment."
"My dog cries out when I touch his ear, and it looks red and swollen.","Possible painful Ear Infection. Avoid touching the ear to prevent further pain. Seek immediate veterinary attention for pain relief and treatment."
"My dog is holding one ear down and seems unbalanced or tilted his head.","Suspected Ear Infection, possibly severe or affecting the inner ear. Keep your dog calm. A vet visit is urgent to prevent further complications like vertigo."
"My dog has a yellowish-green discharge coming from his ear.","Strongly suggests a bacterial Ear Infection. Do not self-treat. A veterinarian needs to assess and prescribe appropriate antibiotics."
"My dog has black, crusty debris in his ears, and they are very itchy.","Likely Ear Mites. Clean the outer ear gently. You'll need vet-prescribed medication (topical or oral) to eradicate the mites. Treat all pets in the household."
"My dog seems to be losing his hearing and his ears look dirty inside.","Could be a chronic Ear Infection or excessive wax build-up. A vet can perform an otoscopic exam and deep cleaning if necessary, along with medication."
"My dog's ear flap is thickened and swollen, like a hematoma.","Possible Ear Hematoma, often caused by vigorous head shaking due to an underlying ear infection. This requires immediate veterinary intervention, often surgical."
"My dog is rubbing his ear against furniture and the floor constantly.","Suspected Ear Infection causing intense itching. Check for any foreign objects or parasites. A vet visit is needed for proper diagnosis and relief."
"My dog is pacing, restless, and occasionally whimpers while shaking his head.","Possible painful Ear Infection. Try to keep your dog calm. Avoid any attempts to clean deep inside the ear. Seek veterinary care promptly for pain management and treatment."
"My dog has a red, inflamed rash inside his ear flap.","Likely Ear Infection or allergic reaction. Clean the outer ear with a gentle, pet-safe ear cleaner. A vet can determine the cause and prescribe appropriate medication."
"My dog recently went swimming and now his ears seem bothering him.","Possible 'Swimmer's Ear' (otitis externa). Gently dry the ear canals after swimming. If irritation persists or discharge appears, consult a vet to prevent infection."
"My dog's ear is hot to the touch and he's scratching it raw.","Suspected Ear Infection with inflammation. Prevent further self-trauma (e.g., e-collar). A vet can provide anti-inflammatory and anti-itch medication, along with infection treatment."
"My dog has small, raised bumps or pimples inside his ear.","Could be a skin infection or irritation within the ear. Avoid squeezing. A vet can properly diagnose and treat these skin lesions."
"My dog is tilting his head frequently and walking in circles.","Strongly suggests a severe Ear Infection, possibly affecting balance (vestibular system). Immediate veterinary attention is critical."
"My dog has a crusty buildup around the opening of his ear canal.","Possible Ear Infection or dermatitis around the ear. Clean the outer area gently with warm water. A vet can assess the ear canal and skin."
"My dog's ear smells sweet or yeasty and is very itchy.","Highly indicative of a Yeast Infection in the ear. Do not try to treat with human products. A vet will prescribe specific antifungal ear drops."
"My dog seems sensitive to loud noises and is shaking his head more than usual.","Could be an Ear Infection causing discomfort. Keep the environment quiet. A vet can check for infection and provide treatment."
"My dog's inner ear seems very greasy and oily, and it smells.","Likely a chronic Ear Infection or excessive sebaceous gland activity. Regular cleaning by a vet may be needed, along with medicated treatment."
"My dog has painful-looking scabs and hair loss around his ears.","Possible severe Ear Infection or allergic reaction leading to self-trauma. Prevent further scratching (e.g., e-collar). A vet can treat the underlying cause and the skin lesions."
"My dog has soft, unformed stools, but seems otherwise active.","Possible mild dietary upset. Withhold food for 12-24 hours (puppies for 6-8 hours). Offer small amounts of water or unflavored Pedialyte. Reintroduce bland food (boiled chicken/rice). If it persists or worsens, see a vet."
"My dog has watery diarrhea and is making frequent trips outside.","Likely intestinal upset. Ensure constant access to fresh water to prevent dehydration. Monitor for lethargy or vomiting. If watery diarrhea continues for more than 24 hours, consult a vet."
"My dog's diarrhea has streaks of fresh red blood in it.","Possible colitis or intestinal irritation. This warrants a veterinary visit soon to determine the cause and get appropriate medication. Keep your dog hydrated."
"My dog is having diarrhea and also vomiting repeatedly.","Suspected gastrointestinal infection or more serious issue. Withhold food and water for 2-4 hours, then offer small ice chips. Seek immediate veterinary attention if vomiting persists or dog becomes lethargic."
"My dog's diarrhea is black and tarry.","Highly indicative of digested blood (melena), a serious sign. This is a medical emergency. Rush your dog to the nearest emergency veterinarian immediately."
"My dog has diarrhea and seems very lethargic and weak.","Possible dehydration or serious underlying illness. Ensure access to water. Seek urgent veterinary attention for diagnosis and fluid therapy."
"My dog is straining to defecate, and passing small amounts of mucousy diarrhea.","Likely colitis or irritation of the large intestine. Offer bland food. Monitor for blood. A vet can prescribe anti-inflammatory medication or antibiotics."
"My puppy has diarrhea and seems listless.","Puppies dehydrate quickly. This is serious. Keep the puppy warm and ensure some fluid intake (e.g., Pedialyte). Seek immediate veterinary attention."
"My dog has diarrhea after eating something unusual or getting into the trash.","Likely dietary indiscretion. Withhold food for 12-24 hours. Offer bland diet. If diarrhea is severe, bloody, or accompanied by vomiting/lethargy, consult a vet."
"My dog's diarrhea is yellow or orange and seems very greasy.","Possible malabsorption or liver/pancreatic issue. Offer a bland, low-fat diet. A vet can perform tests to diagnose the underlying problem and prescribe appropriate treatment."
"My dog is passing diarrhea with worms visible in it.","Confirms intestinal worms. Collect a stool sample for your vet to identify the type of worm. Administer a vet-prescribed dewormer immediately. Clean bedding thoroughly."
"My dog has diarrhea and a fever.","Suggests an infection or inflammation. Keep your dog hydrated and comfortable. A vet visit is necessary for diagnosis and appropriate treatment (e.g., antibiotics)."
"My dog had diarrhea after a stressful event like a trip to the vet or boarding.","Likely stress-induced diarrhea. Provide a quiet, calm environment. Offer bland food. Usually resolves within 24-48 hours. If not, consult a vet."
"My dog's diarrhea has undigested food in it.","Could indicate rapid transit or maldigestion. Offer smaller, more frequent meals of bland food. A vet can investigate if this persists, as it might suggest enzyme deficiency."
