input_text,output_text
"My dog has really bad breath, much worse than usual.","Halitosis (bad breath) is the most common sign of dental disease, often due to bacteria in plaque and tartar. Schedule a vet dental check-up for a thorough oral examination."
"I can see a brown or yellow buildup on my dog's teeth near the gum line.","This is tartar buildup, a clear sign of dental disease. This requires a professional veterinary dental cleaning under anesthesia to remove it effectively and prevent further progression."
"My dog is reluctant to eat hard kibble or chews, but still eats soft food.","Pain from dental disease (e.g., loose teeth, gum inflammation, cavities) can make chewing painful. A vet needs to examine his mouth to identify the source of pain and provide treatment."
"My dog's gums look red, swollen, or are bleeding when he chews.","These are signs of gingivitis (gum inflammation), an early stage of dental disease. Schedule a vet visit for assessment and discuss professional cleaning and home care options."
"My dog is drooling excessively, and sometimes the saliva has a reddish tint.","Excessive drooling can indicate oral pain or discomfort from severe dental disease. Blood-tinged drool is a serious sign. A vet visit is urgently needed to address the pain and underlying issue."
"My dog is pawing at his mouth, rubbing his face, or seems to have pain around his jaw.","These behaviors suggest oral pain, likely due to advanced dental disease, a broken tooth, or an abscess. A vet examination is crucial to identify and treat the source of pain."
"My dog has lost weight, and I've noticed he's not eating as much as before.","Significant dental pain can lead to reduced food intake and weight loss. A vet needs to perform a thorough oral exam under sedation or anesthesia to find painful teeth."
"I noticed a missing tooth or a broken tooth in my dog's mouth.","Missing teeth can be a sign of advanced periodontal disease. Broken teeth are painful and can lead to infection. A vet needs to assess for infection and discuss extraction or other treatments."
"My dog has pus or swelling on his face, especially under his eye or jaw.","This strongly suggests a dental abscess (infection at the tooth root). This is a serious infection that can spread. Seek immediate veterinary attention for antibiotics and likely tooth extraction."
"My dog is sneezing frequently, or has a nasal discharge, and also has bad breath.","Severe dental disease, especially of the upper canine or premolar teeth, can sometimes lead to an oral-nasal fistula (a hole) or infection spreading to the nasal cavity. A vet needs to investigate this."
"My dog is reluctant to let me touch his face or mouth, which is unusual for him.","This can be a sign of oral pain from dental disease. Avoid forcing examination if he's in pain. Schedule a vet visit for a professional, gentle examination."
"My dog is making chomping or chattering noises with his jaw, or seems uncomfortable when closing his mouth.","These behaviors can indicate pain or discomfort from dental issues. A vet can examine the teeth and jaw for problems."
"My dog has lumps or growths in his mouth that look suspicious.","While not always dental disease, oral masses can be cancerous or indicative of severe inflammation. A vet needs to examine and biopsy any lumps in the mouth."
"My dog is an older dog and has very severe tartar buildup and red gums.","Older dogs are prone to advanced dental disease. Even if they seem to be eating, severe dental disease can be painful and impact overall health. A vet can assess the best approach for senior dental care."
"My dog seems to be losing interest in toys he used to love to chew.","If a dog suddenly stops chewing on toys, it could be due to oral pain from dental disease. A vet can check for underlying dental problems."
"My dog's teeth are loose or look like they are shifting.","Loose or shifting teeth are signs of severe periodontal disease and bone loss. These teeth often need to be extracted to alleviate pain and prevent infection. A vet visit is necessary."
"My dog was diagnosed with heart or kidney disease, and the vet mentioned dental health.","Bacteria from severe dental disease can enter the bloodstream and impact distant organs. Managing dental disease is crucial for overall systemic health, especially in dogs with other chronic conditions."
"My dog seems to have difficulty closing his mouth fully, or his jaw seems misaligned.","Severe dental disease, particularly with broken teeth or abscesses, can sometimes cause jaw pain or misalignment. A vet can diagnose and treat this."
"My dog has receding gums, exposing more of the tooth root.","Gum recession is a sign of advanced periodontal disease and bone loss. This exposes sensitive tooth surfaces. A vet can assess the extent of damage and recommend treatment."
"I want to prevent dental disease in my dog. What should I do?","Regular home dental care is key: daily tooth brushing with dog-specific toothpaste, dental chews/diets approved by the Veterinary Oral Health Council (VOHC), and annual professional veterinary dental check-ups, with cleanings as recommended by your vet."
"My dog's gums and the whites of his eyes have turned yellow.","This is jaundice (icterus), a hallmark sign of severe liver dysfunction. This is a medical emergency. Rush your dog to the nearest emergency veterinarian immediately."
"My dog is suddenly very lethargic, has lost his appetite, and is vomiting frequently.","These are common, early, but non-specific signs of liver disease. A vet visit is crucial for immediate blood tests (liver enzymes, bilirubin) and diagnosis."
"My dog is drinking and urinating much more than usual, and seems generally unwell.","Increased thirst and urination (polydipsia/polyuria) can be symptoms of liver disease or other serious conditions. A vet needs to perform blood work and urinalysis to investigate."
"My dog's abdomen is swollen, and he seems to be in discomfort, but he hasn't gained weight elsewhere.","Abdominal distension can be due to fluid buildup (ascites) caused by advanced liver disease. This is a serious symptom. Seek immediate veterinary attention."
"My dog has unexplained weight loss and muscle wasting despite eating normally, or even with increased appetite.","Chronic liver disease can lead to poor nutrient absorption and metabolism, resulting in weight loss and muscle atrophy. A vet visit is crucial for diagnosis and dietary management."
"My dog is experiencing neurological signs like disorientation, aimless pacing, pressing his head against walls, or seizures.","These are signs of hepatic encephalopathy, a severe complication of advanced liver disease where toxins build up and affect the brain. This is a medical emergency. Rush your dog to the nearest emergency veterinarian."
"My dog's stool is pale or grey-colored, and his urine is very dark (orange to brown).","Pale stools indicate a lack of bile (produced by the liver) reaching the intestines, while dark urine indicates bilirubin excretion. Both are strong signs of liver or biliary disease. Seek immediate veterinary attention."
"My dog is bruising easily, has nosebleeds, or blood in his stool.","Liver disease can impair the liver's ability to produce clotting factors, leading to bleeding disorders. This is a serious complication. A vet needs to assess blood clotting function immediately."
"My dog is vomiting intermittently and just seems generally unwell, with a poor coat quality.","Chronic, subtle symptoms like intermittent vomiting and a dull coat can indicate ongoing liver disease. A vet can perform specific liver function tests."
"My dog is older and has suddenly become very tired, not eating, and seems painful in his upper abdomen.","Older dogs can be more prone to liver issues. Upper abdominal pain, especially with vomiting and lethargy, warrants an urgent vet visit to rule out acute liver inflammation or other conditions."
"My dog seems excessively thirsty, drinking large amounts of water, and has developed a 'pot-belly'.","While also a sign of Cushing's, this combination of symptoms can also be seen in chronic liver disease. A vet can differentiate through comprehensive blood tests."
"My dog has a poor appetite and seems to have selective eating, only wanting certain foods.","Picky eating or anorexia are common in liver disease due to nausea or discomfort. Encourage palatable foods. A vet needs to address the underlying cause and provide nutritional support."
"My dog has developed fluid swelling in his legs or paws.","Peripheral edema (swelling) can occur in advanced liver disease due to low protein levels (albumin) in the blood. This needs urgent veterinary assessment."
"My dog is experiencing a chronic cough and seems to have difficulty breathing, along with other sickness signs.","While less common as a primary sign, advanced liver disease can impact other organ systems, including the respiratory system. A vet can investigate the cause."
"My dog's breath has a strange, sickly sweet, or musty odor.","A specific foul or musty breath odor can be a sign of advanced liver failure (fetor hepaticus). This is a serious symptom requiring immediate veterinary attention."
"My dog seems generally anxious, restless, and paces without apparent reason, especially at night.","Behavioral changes, particularly restlessness or anxiety, can be a subtle manifestation of hepatic encephalopathy. A vet needs to investigate this."
"My dog was recently exposed to a toxin (e.g., certain medications, chemicals, moldy food), and now has vomiting and lethargy.","Acute liver injury can result from exposure to toxins. If recent exposure is suspected, contact your veterinarian or a poison control center immediately."
"My dog has been diagnosed with a liver shunt (portosystemic shunt). What does that mean for him?","A liver shunt is a congenital or acquired vascular anomaly where blood bypasses the liver, leading to toxin buildup. It requires lifelong dietary management and often surgical correction, managed by a specialist vet."
"My dog's blood tests showed elevated liver enzymes, but he seems normal.","Elevated liver enzymes (e.g., ALT, ALP) indicate liver cell damage or cholestasis. Even if asymptomatic, a vet needs to investigate the cause with further tests to prevent progression of disease."
"My dog has been diagnosed with chronic liver disease. What's the best long-term care?","Long-term management of liver disease involves a specific prescription diet (low protein, easily digestible), medications to support liver function and reduce toxin buildup, and regular vet monitoring of blood work. Follow your vet's instructions closely."
"My kitten is suddenly extremely lethargic, won't eat, and has a high fever.","These are critical early signs of Feline Panleukopenia. This is a **medical emergency**. Isolate your kitten from all other cats immediately and contact your veterinarian for urgent assessment and treatment. Do not delay."
"My cat is vomiting profusely and has severe, bloody diarrhea with a distinct, foul odor.","Strongly indicative of Feline Panleukopenia. This leads to rapid dehydration and systemic infection. Seek immediate emergency veterinary attention. Inform the clinic of suspected Panleukopenia before arrival."
"My unvaccinated kitten suddenly collapsed, is very weak, and her body temperature is low.","Highly suspicious for severe Feline Panleukopenia with shock. This requires immediate emergency veterinary care. Keep your kitten warm and handle gently. Prognosis is poor without aggressive treatment."
"My cat is hunching over her water bowl but not drinking, and is constantly vomiting up clear fluid.","Severe nausea, dehydration, and a characteristic 'praying' or hunched posture can be seen in Feline Panleukopenia. This requires urgent veterinary intervention for fluid therapy and anti-nausea medication."
"My kitten's gums are very pale, she's extremely weak, and unresponsive.","These are signs of severe anemia, dehydration, and circulatory shock common in advanced Feline Panleukopenia. This is a dire emergency. Rush your kitten to the nearest emergency veterinary clinic."
"My cat, who hasn't completed her vaccinations, is showing depression, loss of appetite, and then started vomiting.","Early progression of Feline Panleukopenia. The virus attacks the immune system. Isolate your cat. Contact your vet immediately for testing and aggressive treatment."
"My kitten's stool is black and tarry, and she's also vomiting profusely.","This indicates digested blood (melena), a severe complication of Feline Panleukopenia affecting the intestinal lining. This is a medical emergency. Rush your kitten to the vet immediately."
"My cat is shivering uncontrollably, seems disoriented, and has severe diarrhea.","Signs of shock and severe illness from Feline Panleukopenia. Keep your cat warm. Seek immediate emergency veterinary attention. Do not attempt home remedies."
"My cat had contact with an infected cat, and now has severe vomiting and diarrhea.","High risk of Feline Panleukopenia infection. Even if vaccinated, contact your veterinarian immediately for testing and guidance, as partial immunity might not prevent illness. Isolate the cat."
"My cat is passing large quantities of foul-smelling, bloody fluid from her rectum.","Classic symptom of hemorrhagic enteritis caused by Feline Panleukopenia. This leads to massive fluid loss and can be fatal quickly. Immediate veterinary hospitalization is essential."
"My kitten is showing neurological signs like tremors, uncoordinated movements, or inability to stand.","If a pregnant queen is infected, kittens can be born with cerebellar hypoplasia (wobbly gait), a neurological effect of the virus. Any acute neurological signs with other symptoms warrant immediate vet care."
"My cat is extremely depressed, unwilling to move, and has severe vomiting with no interest in food or water.","Severe depression and anorexia are primary indicators of serious illness like Feline Panleukopenia. Do not force feed. Contact your veterinarian for immediate consultation and diagnostic testing."
"My cat's white blood cell count is extremely low, confirmed by a vet, and she has vomiting/diarrhea.","A very low white blood cell count (leukopenia/panleukopenia) is characteristic of this virus. This means the cat's immune system is severely compromised, making intensive veterinary support vital to fight secondary infections."
"My unvaccinated kitten developed vomiting and diarrhea suddenly after being boarded or rescued.","High risk of Feline Panleukopenia due to exposure in a communal environment. Isolate the kitten. Contact your vet immediately and explain the situation for urgent testing and treatment protocols."
"My cat is showing signs of shock, rapid breathing, weak pulse, and cold paws, along with vomiting.","Feline Panleukopenia can quickly lead to hypovolemic shock. This is a critical emergency. Get your cat to an emergency veterinary clinic immediately."
"My cat, typically very clean, is completely unkempt, refuses to groom, and has crusting around her nose and eyes, along with GI signs.","An infected cat feels too sick to groom. The unkempt appearance, combined with severe GI and respiratory signs, points to a very serious illness like Panleukopenia. Urgent vet attention is needed."
"My cat is making constant crying or whimpering noises and seems to be in intense abdominal pain.","Intense abdominal pain suggests severe intestinal damage, common in Feline Panleukopenia. This warrants immediate veterinary pain management and assessment for complications."
"My kitten seems dehydrated; her skin is less elastic, and she's not drinking or keeping anything down.","Dehydration is the primary killer in Panleukopenia. Encourage water intake if possible, but immediate veterinary attention for subcutaneous or intravenous fluids is vital."
"My cat is very sensitive to touch, especially her abdomen, and seems to be in agony.","Severe abdominal pain and sensitivity are characteristic of the enteritis caused by Feline Panleukopenia. Handle gently and seek immediate veterinary care."
"My cat was recently diagnosed with Feline Panleukopenia, what can I do at home to help her?","There is **no effective first aid or home treatment for Feline Panleukopenia.** Survival rates are significantly higher with aggressive veterinary hospitalization, including IV fluids, anti-nausea medications, antibiotics for secondary infections, and nutritional support. Focus on getting your cat to the vet immediately and strictly isolating them."
"My cat has persistent lethargy, seems generally unwell, and isn't as active as usual.","Persistent lethargy is a common, non-specific sign of FeLV, indicating a compromised immune system or associated illness. A vet visit for FeLV testing is crucial, especially if the cat has an unknown history or outdoor access."
"My cat's appetite has significantly decreased, and she's losing weight despite no change in diet.","Unexplained weight loss and chronic anorexia are common signs of FeLV, often due to associated cancers, secondary infections, or general ill health. A vet should perform an FeLV test and full workup."
"My cat has recurrent fever of unknown origin that comes and goes.","FeLV can cause persistent or recurring fevers due to chronic inflammation or secondary infections that the compromised immune system can't fight off. A vet should test for FeLV and other underlying causes."
"My cat has pale gums and seems weak, and a vet mentioned she might be anemic.","Anemia is a very common complication of FeLV, often caused by bone marrow suppression or immune-mediated destruction of red blood cells. A vet needs to confirm anemia and test for FeLV."
"My cat has chronic diarrhea that isn't resolving with typical treatments.","FeLV can cause chronic gastrointestinal issues, either directly or by making the cat susceptible to persistent infections. A vet needs to test for FeLV and investigate the cause of the diarrhea."
"My cat has swollen lymph nodes, especially in her neck, armpits, or groin.","Swollen lymph nodes are a common sign of lymphoma (a type of cancer) or other immune system responses associated with FeLV. A vet needs to investigate these changes immediately."
"My cat has recurrent skin infections or poor coat quality that doesn't improve with regular care.","FeLV compromises the immune system, making cats more prone to chronic or recurrent skin problems and dull coats. A vet visit for FeLV testing and dermatological assessment is recommended."
"My cat developed oral infections, severe gingivitis, or stomatitis (mouth inflammation).","Chronic mouth issues like severe gum inflammation that don't respond to typical treatment can be a sign of FeLV-associated immunosuppression. A vet needs to perform an oral exam and FeLV test."
"My cat has chronic respiratory infections (like colds or pneumonia) that keep recurring.","FeLV makes cats highly susceptible to persistent or recurrent upper respiratory infections and pneumonia. If your cat has these issues, a vet should test for FeLV."
"My cat is showing signs of neurological problems like seizures, wobbliness, or behavioral changes.","While less common, FeLV can directly affect the nervous system or cause neurological signs due to associated conditions like lymphoma. A vet needs to perform a full neurological exam and FeLV test."
"My cat has developed tumors or masses anywhere on his body.","FeLV is strongly associated with various types of cancer, particularly lymphoma and leukemia. Any new mass or tumor should prompt an immediate vet visit and FeLV testing."
"My cat has persistent eye infections or discharge that doesn't respond to medication.","FeLV can manifest with chronic ocular (eye) problems due to immune suppression. A vet needs to examine the eyes and test for FeLV."
"My kitten seems to be failing to thrive, not growing properly, and has recurrent illnesses.","Kittens infected in utero or shortly after birth often have severe symptoms and poor prognosis. A vet visit for FeLV testing is critical for any 'fading kitten'."
"My cat was exposed to an FeLV-positive cat. What should I do?","If your cat was exposed to an FeLV-positive cat, get them tested immediately, and then re-tested in 30-60 days, as it can take time for the virus to show on tests. Keep them isolated from other cats until confirmed negative. Discuss vaccination with your vet."
"My cat is having difficulty breathing or rapid breathing, without obvious signs of a cold.","FeLV can lead to various respiratory issues, including lymphoma in the chest or fluid buildup. This is a serious symptom requiring immediate veterinary attention."
"My cat is currently outdoor or has outdoor access. Should I test them for FeLV?","All outdoor or indoor-outdoor cats should be tested for FeLV annually (or as per vet recommendation) due to their increased risk of exposure. Vaccination is also highly recommended."
"My cat is losing blood, either internally or externally, and seems very weak.","FeLV can cause various blood disorders, including those that affect clotting. Any unexplained bleeding warrants immediate veterinary attention and FeLV testing."
"My cat had a minor injury or surgery, and the recovery is unusually slow or complicated.","A compromised immune system due to FeLV can lead to poor wound healing and prolonged recovery times. This warrants investigating underlying health issues like FeLV."
"I just adopted a new cat, and I want to ensure it's healthy for my existing cats.","All newly adopted cats, especially those with unknown backgrounds or from shelters, should be tested for FeLV (and FIV) before being introduced to resident cats. Keep them isolated until test results are back."
"My cat tested positive for FeLV. What is the prognosis and management?","FeLV is a serious diagnosis, but with proper care, many FeLV-positive cats can live for several years. Management involves a high-quality diet, regular vet check-ups (every 6 months), prompt treatment of secondary infections, keeping them strictly indoors to prevent spread and exposure to other diseases, and avoiding stress. There is no cure, but supportive care improves quality of life."
"My outdoor male cat has frequent bite wounds or abscesses, and seems to get sick often.","Frequent bite wounds are the primary mode of FIV transmission. Recurrent infections are a sign of a compromised immune system. An FIV test is highly recommended. Vet check for wounds and overall health is crucial."
"My cat has chronic, non-responsive gingivitis and stomatitis (severe mouth inflammation and pain).","Chronic, severe oral inflammation is a very common symptom of FIV, often leading to extreme pain and difficulty eating. A vet needs to perform an oral exam and an FIV test."
"My cat has persistent lethargy, seems generally unwell, and is losing weight despite eating.","Chronic lethargy and unexplained weight loss are common signs of FIV, often due to associated secondary infections or compromised health. A vet visit for an FIV test and full workup is crucial."
"My cat has recurrent or persistent fevers of unknown origin.","FIV can cause recurring fevers as the compromised immune system struggles to fight off infections. A vet should test for FIV and investigate other underlying causes."
"My cat has chronic diarrhea that isn't resolving with typical treatments.","FIV can cause chronic gastrointestinal issues, either directly or by making the cat susceptible to persistent infections. A vet needs to test for FIV and investigate the cause of the diarrhea."
"My cat has recurrent skin infections, poor coat quality, or chronic ear infections.","FIV compromises the immune system, making cats prone to persistent or recurrent skin problems, ear infections, and dull coats. A vet visit for an FIV test and dermatological assessment is recommended."
"My cat has chronic upper respiratory infections (like colds or persistent sneezing) that keep recurring.","FIV makes cats highly susceptible to persistent or recurrent upper respiratory infections. If your cat has these issues, a vet should test for FIV."
"My cat is showing signs of neurological problems like behavioral changes, seizures, or vision loss.","While less common, FIV can directly affect the nervous system, leading to cognitive dysfunction, behavioral changes, or seizures. A vet needs to perform a full neurological exam and FIV test."
"My cat has developed various types of cancer, particularly lymphoma or leukemia.","FIV increases a cat's risk of developing certain cancers, especially lymphomas. Any new mass or tumor should prompt an immediate vet visit and FIV testing."
"My cat has persistent eye infections, conjunctivitis, or discharge that doesn't respond to medication.","FIV can manifest with chronic ocular (eye) problems due to immune suppression. A vet needs to examine the eyes and test for FIV."
"My cat is generally unkempt, not grooming herself well, and seems depressed.","A cat with FIV may feel too unwell to groom, leading to a dull or matted coat. Depression and lack of self-care are signs of chronic illness. A vet check, including an FIV test, is warranted."
"My cat has developed chronic kidney disease or other organ system issues at a relatively young age.","FIV can predispose cats to various chronic conditions affecting organs like the kidneys. If a younger cat shows signs of chronic organ disease, FIV should be considered. A vet can investigate."
"My cat is producing pus-like discharge from his nose or eyes that persists for weeks.","Chronic purulent (pus-filled) discharge indicates a persistent infection that the immune system is struggling to clear, often seen in FIV-positive cats. A vet needs to investigate and test for FIV."
