input_text,output_text
"My cat has a lump on her skin that feels warm and painful, and might be an abscess.","Suspected abscess, often from a bite wound. This requires immediate veterinary attention for drainage, cleaning, and antibiotics. Do not try to pop it yourself."
"My cat's paw pads are red, swollen, and she's licking them excessively.","Possible paw pad infection, allergy, or foreign body. Soak paws in warm water. Prevent licking with an E-collar. If swelling, pus, or lameness is present, consult a vet."
"My cat has dandruff-like flakes, and her skin seems generally unhealthy.","Could be dry skin, allergies, or early signs of a skin infection. Ensure proper nutrition. Use a pet-specific moisturizing shampoo. If persistent or severe, a vet can diagnose any underlying issues."
"My cat has a foul odor emanating from her skin, even after grooming.","Strongly suggests a bacterial or yeast skin infection. Regular bathing with a vet-prescribed medicated shampoo may be necessary. A vet visit is crucial for proper diagnosis and oral treatment."
"My cat is pulling out her fur in clumps, leaving raw spots, but no visible parasites.","Possible self-trauma from intense itching due to underlying skin infection or allergy. Use an E-collar to prevent further damage. A vet can diagnose and treat the root cause."
"My cat has sores and crusts around her mouth and chin.","Likely Feline Acne or a bacterial infection. Gently clean the area with a mild antiseptic. Avoid plastic bowls. If severe or persistent, a vet can prescribe topical or oral medication."
"My cat's skin feels bumpy and rough to the touch, with small crusts over her back.","Could be 'miliary dermatitis,' often an allergic reaction or flea bite hypersensitivity. Check thoroughly for fleas. A vet can provide medication to reduce the allergic response and treat any secondary infection."
"My cat has patches of pus-filled blisters on her skin.","This is a sign of a severe bacterial skin infection. Do not try to drain them. Seek immediate veterinary attention for diagnosis and appropriate antibiotic treatment."
"My cat's ears are crusty and itchy, and she's shaking her head.","While often ear mites, this can lead to skin infection around the ears. Clean the outer ear. A vet needs to diagnose and treat both the mites and any secondary skin infection."
"My cat has a persistent, non-healing wound on her skin that looks infected.","Any wound that doesn't heal or looks infected (redness, swelling, pus) needs veterinary attention. It might require cleaning, debridement, and antibiotics."
"My cat is constantly licking her perineal area, and the skin around it looks red and irritated.","Possible anal gland issue, diarrhea irritation, or skin infection. Clean the area gently. A vet needs to examine the anal glands and treat any skin irritation or infection."
"My cat is excessively shedding, and her underlying skin is red and inflamed.","Excessive shedding with inflamed skin suggests an underlying skin condition or infection. Regular brushing can help, but a vet visit is crucial to diagnose the cause (e.g., allergies, poor diet, infection) and provide treatment."
"My cat has a red, itchy patch of skin that he keeps licking and chewing.","Suspected skin infection or 'hot spot'. Gently clean the area with mild antiseptic solution (e.g., dilute chlorhexidine). Prevent further licking with an E-collar. A vet visit is recommended to determine the cause and prescribe medication."
"I found a raw, oozing sore on my cat's body that smells bad.","Likely a severe bacterial skin infection. Gently clean the area with warm water and mild soap. Do not apply human creams without vet approval. Seek immediate veterinary attention for cleaning, antibiotics, and pain relief."
"My cat has scabs and hair loss, especially around her ears and neck.","Possible skin infection, often due to fleas, mites, or allergies. Check for fleas and treat with a vet-approved product. Clean affected areas gently. A vet visit is crucial for diagnosis and specific treatment."
"My cat has small, red bumps or pustules on her skin, often around her belly.","Likely bacterial skin infection (pyoderma) or folliculitis. Do not squeeze. Clean gently with a pet-safe antiseptic wash. A vet can prescribe oral antibiotics or medicated shampoos."
"My cat's skin is flaky and very greasy, and she smells yeasty.","Strongly suggests a yeast infection on the skin. A vet will need to diagnose and prescribe antifungal shampoos or oral medication. Regular bathing with a vet-recommended product can help."
"My cat has circular, red, scaly patches of skin with hair loss.","Highly suggestive of Ringworm (fungal infection), which is contagious to humans. Wear gloves when handling. Isolate your cat. Seek immediate veterinary attention for diagnosis and antifungal treatment. Disinfect the environment."
"My cat is scratching intensely all over her body, and her skin looks irritated.","Possible skin infection due to severe allergies (flea, food, environmental) or parasites. A vet visit is essential to diagnose the underlying cause and provide anti-itch and anti-inflammatory medication."
"My cat has thickened, darkened skin, especially in her armpits or groin.","Likely chronic skin inflammation or infection. This needs veterinary assessment to determine the cause (e.g., chronic allergies, hormonal issues) and long-term management."
"My cat has a lump on her skin that feels warm and painful, and might be an abscess.","Suspected abscess, often from a bite wound. This requires immediate veterinary attention for drainage, cleaning, and antibiotics. Do not try to pop it yourself."
"My cat's paw pads are red, swollen, and she's licking them excessively.","Possible paw pad infection, allergy, or foreign body. Soak paws in warm water. Prevent licking with an E-collar. If swelling, pus, or lameness is present, consult a vet."
"My cat has dandruff-like flakes, and her skin seems generally unhealthy.","Could be dry skin, allergies, or early signs of a skin infection. Ensure proper nutrition. Use a pet-specific moisturizing shampoo. If persistent or severe, a vet can diagnose any underlying issues."
"My cat has a foul odor emanating from her skin, even after grooming.","Strongly suggests a bacterial or yeast skin infection. Regular bathing with a vet-prescribed medicated shampoo may be necessary. A vet visit is crucial for proper diagnosis and oral treatment."
"My cat is pulling out her fur in clumps, leaving raw spots, but no visible parasites.","Possible self-trauma from intense itching due to underlying skin infection or allergy. Use an E-collar to prevent further damage. A vet can diagnose and treat the root cause."
"My cat has sores and crusts around her mouth and chin.","Likely Feline Acne or a bacterial infection. Gently clean the area with a mild antiseptic. Avoid plastic bowls. If severe or persistent, a vet can prescribe topical or oral medication."
"My cat's skin feels bumpy and rough to the touch, with small crusts over her back.","Could be 'miliary dermatitis,' often an allergic reaction or flea bite hypersensitivity. Check thoroughly for fleas. A vet can provide medication to reduce the allergic response and treat any secondary infection."
"My cat has patches of pus-filled blisters on her skin.","This is a sign of a severe bacterial skin infection. Do not try to drain them. Seek immediate veterinary attention for diagnosis and appropriate antibiotic treatment."
"My cat's ears are crusty and itchy, and she's shaking her head.","While often ear mites, this can lead to skin infection around the ears. Clean the outer ear. A vet needs to diagnose and treat both the mites and any secondary skin infection."
"My cat has a persistent, non-healing wound on her skin that looks infected.","Any wound that doesn't heal or looks infected (redness, swelling, pus) needs veterinary attention. It might require cleaning, debridement, and antibiotics."
"My cat is constantly licking her perineal area, and the skin around it looks red and irritated.","Possible anal gland issue, diarrhea irritation, or skin infection. Clean the area gently. A vet needs to examine the anal glands and treat any skin irritation or infection."
"My cat is excessively shedding, and her underlying skin is red and inflamed.","Excessive shedding with inflamed skin suggests an underlying skin condition or infection. Regular brushing can help, but a vet visit is crucial to diagnose the cause (e.g., allergies, poor diet, infection) and provide treatment."
"My cat is sneezing frequently and has watery eyes, like a human cold.","Suspected Cat Flu. Keep your cat warm and comfortable. Gently wipe discharge from eyes and nose with a damp cloth. Encourage drinking water. If symptoms worsen, consult a vet."
"My cat has a runny nose with thick, yellow-green discharge and seems congested.","Likely Cat Flu with a bacterial component. Gently clean nasal discharge. Encourage appetite by offering strong-smelling, palatable food. A vet visit is recommended for antibiotics to treat secondary infections."
"My cat is lethargic, has a fever, and is refusing to eat or drink.","Possible severe Cat Flu or dehydration. Try offering tempting wet food or chicken broth. Ensure constant access to fresh water. Seek immediate veterinary attention for fluid therapy and support."
"My cat's eyes are red and swollen, and she has pus-like discharge, almost glued shut.","Likely severe conjunctivitis due to Cat Flu. Gently clean eyes with warm, damp cotton balls to remove crusts. A vet can prescribe antibiotic eye drops or ointment to prevent permanent damage."
"My cat is coughing and making gagging noises, sometimes after sneezing.","Could be Cat Flu irritating the throat. Provide a humid environment (e.g., steamy bathroom). Ensure plenty of rest. If cough is persistent or breathing becomes labored, consult a vet."
"My kitten has sneezing, nasal discharge, and seems very weak.","Kittens are highly vulnerable to Cat Flu and dehydrate quickly. Keep the kitten warm and offer frequent, small amounts of kitten milk replacer or wet food. Seek immediate veterinary attention."
"My cat's nose is dry and crusted, and she seems to have difficulty breathing through it.","Suspected Cat Flu causing nasal blockage. Gently moisten crusts with a damp cloth. Consider a humidifier. If breathing is labored (open-mouth breathing), seek emergency vet care."
"My cat has ulcers in her mouth and on her tongue, making it painful to eat.","Likely severe Cat Flu (e.g., Calicivirus). Offer soft, palatable foods. Ensure constant water access. A vet can provide pain relief and medication to manage the ulcers."
"My cat sounds hoarse or has a changed meow, and is generally unwell.","Could be Cat Flu affecting the voice box. Ensure quiet rest and hydration. If hoarseness persists or is accompanied by severe breathing issues, consult a vet."
"My cat is drooling excessively and has swollen lymph nodes under her jaw.","Possible Cat Flu with secondary bacterial infection or severe oral inflammation. A vet visit is recommended to assess the oral cavity and prescribe antibiotics."
"My cat is rubbing her face a lot, and her eyes seem irritated, with clear discharge.","Likely early signs of Cat Flu or an irritant. Gently wipe eyes. Monitor for worsening symptoms like colored discharge or lethargy. If symptoms persist, consult a vet."
"My cat is hiding more than usual, has a slight runny nose, and seems depressed.","Possible Cat Flu causing general malaise. Provide a quiet, warm, comfortable space. Offer favorite foods. If hiding or depression continues, see a vet."
"My cat has a sore throat and is reluctant to swallow food or even water.","Suspected Cat Flu making swallowing painful. Offer warm, soft, strong-smelling foods. Ensure easy access to water. A vet can provide pain relief and diagnose any severe throat inflammation."
"My cat has a clear eye discharge that keeps crusting, and she squints often.","Likely conjunctivitis from Cat Flu. Gently clean eyes with saline or warm water. A vet can provide specific eye drops if the irritation or discharge is persistent or severe."
"My cat has lost her sense of smell and isn't interested in food, even preferred treats.","Cat Flu often impairs smell, leading to anorexia. Offer very aromatic, wet, warmed food. Try tuna juice or chicken broth. If anorexia persists for more than 24 hours, seek vet attention for nutritional support."
"My cat is breathing rapidly and with effort, after a few days of cold symptoms.","Indicates possible pneumonia or severe respiratory compromise due to Cat Flu. This is a medical emergency. Seek immediate veterinary attention."
"My cat seems dehydrated; her skin is less elastic, and she's not drinking.","Dehydration is a serious complication of Cat Flu, especially if fever or anorexia are present. Encourage water intake. Seek urgent veterinary attention for subcutaneous or intravenous fluids."
"My cat has swollen glands on her neck and seems uncomfortable when touched there.","Likely swollen lymph nodes due to Cat Flu. This is common. Focus on supportive care and encourage rest. If swelling is excessive or painful, a vet can assess."
"My cat has a very stuffy nose, she's breathing through her mouth, and her tongue is out.","Indicates severe nasal congestion from Cat Flu. Provide a humidifier. Gently try to clear nasal passages. If mouth breathing is continuous, it's a sign of significant respiratory distress; seek immediate vet care."
"My cat is generally unwell, sneezing, and looks unkempt because she's not grooming.","Cat Flu often makes cats feel too unwell to groom. Gently brush her to prevent matting. Focus on supportive care (warmth, hydration, palatable food). If lack of grooming persists, it's a sign she's not recovering."
"My cat is making frequent trips to the litter box but only producing small amounts of urine.","Suspected UTI. Ensure multiple, clean litter boxes. Offer plenty of fresh water to encourage flushing. If frequency continues or cat shows pain, consult a veterinarian promptly."
"My cat is straining to urinate and crying out in the litter box.","Likely painful UTI or partial blockage. This is a serious symptom. Observe immediately if any urine is produced. Seek immediate veterinary attention, especially for male cats, as this could indicate a life-threatening blockage."
"I found blood in my cat's urine or reddish-pink urine in the litter box.","Strongly suggests a UTI, bladder stones, or other serious urinary issue. Collect a urine sample if possible. Seek immediate veterinary attention for diagnosis and treatment."
"My cat is urinating outside the litter box, especially on cool surfaces like tile or in sinks.","Common sign of UTI or FLUTD (Feline Lower Urinary Tract Disease) due to discomfort. Clean accidents thoroughly with enzymatic cleaner. Ensure multiple, clean litter boxes. A vet visit is crucial to rule out medical causes."
"My male cat is straining to urinate, vocalizing, and no urine is coming out.","This is a **medical emergency** and indicates a complete urinary blockage. Rush your male cat to the nearest emergency veterinarian immediately. This can be fatal if not treated quickly."
"My cat is licking her genital area excessively.","Possible UTI or irritation. Observe for other urinary symptoms. Gently check the area for redness or discharge. A vet can determine the cause and provide treatment."
"My cat is generally irritable, seems painful in her abdomen, and has difficulty urinating.","Suspected painful UTI. Avoid pressing on the abdomen. Provide a quiet, comfortable space. Seek immediate veterinary attention for pain relief and diagnosis."
"My cat's urine has a strong, pungent odor that's unusual.","Could be a sign of a UTI. Ensure proper hydration. A vet can test the urine to confirm infection and identify the bacteria."
"My cat has clear urine but is still going to the litter box very frequently.","Possible early UTI or behavioral issue. Encourage hydration. Monitor for other symptoms like straining or pain. If persistent, a vet can perform a urinalysis."
"My cat is only passing drops of urine, even though she's trying hard.","Likely a severe UTI or partial blockage. This needs immediate veterinary assessment, especially for male cats. Do not delay."
"My cat seems to have accidents around the house and drinks more water than usual.","Increased thirst and inappropriate urination can be signs of UTI or kidney issues. A vet visit is important for blood work and urinalysis to determine the cause."
"My cat's litter box habits have changed; she's spending a lot more time in the box.","This often indicates urinary discomfort or a UTI. Observe for straining or vocalizing. A vet can perform a full urinary workup."
"My cat is producing very cloudy urine in the litter box.","Cloudy urine can indicate crystals, cells, or bacteria associated with a UTI. A vet can analyze the urine to identify the cause and prescribe treatment."
"My cat seems to be in pain when picked up, especially around her lower abdomen.","Possible bladder inflammation or UTI pain. Handle gently. Seek veterinary attention to diagnose the source of abdominal discomfort."
"My cat has been diagnosed with a UTI before, and now shows similar symptoms again.","Likely a recurring UTI. Continue previous treatment only if prescribed by vet. A new vet visit is necessary for a fresh diagnosis and to ensure the correct antibiotic is used to prevent resistance."
"My cat has a low appetite and seems lethargic, along with signs of urinary issues.","Systemic signs alongside urinary symptoms can indicate a more severe UTI or kidney involvement. Ensure hydration. A vet visit is crucial for a full assessment."
"My cat is passing small, hard clumps of urine in the litter, and seems constipated.","While often constipation, bladder issues can also cause straining. Rule out urinary issues first, especially if struggling in the litter box. A vet can differentiate."
"My cat is spraying urine on vertical surfaces more than usual.","While often behavioral, a sudden increase in spraying, especially if accompanied by straining or frequent urination, can indicate a UTI. A vet visit is recommended to rule out medical causes."
"My cat seems very restless, constantly moving in and out of the litter box, and vocalizing.","Strongly suggests urinary discomfort or a possible blockage. Monitor for urine production. Seek immediate veterinary attention if vocalization is severe or no urine is passed."
"My cat is hiding, growling when approached, and has urinated outside the box.","Behavioral changes combined with inappropriate urination often point to pain from a UTI or other urinary issue. Respect her space. A vet visit is necessary to diagnose and alleviate pain."
"My cat vomited once after eating too quickly, but seems fine now and is eating normally.","Likely a case of eating too fast or dietary indiscretion. Offer smaller, more frequent meals. Monitor for further vomiting or other symptoms. No immediate action if no other symptoms appear."
"My cat is vomiting frequently, several times in an hour, but nothing is coming up now.","Suspected repeated dry heaving or persistent vomiting. Withhold food and water for 2-4 hours. Offer small ice chips. If vomiting continues or cat becomes lethargic, seek immediate veterinary attention."
"My cat is vomiting and also has diarrhea.","Likely gastrointestinal upset or infection. Ensure constant access to fresh water to prevent dehydration. Withhold food for 12 hours. If vomiting/diarrhea persists or cat becomes weak, seek immediate veterinary attention."
"My cat is vomiting foam or bile, especially in the morning before eating.","Could be an empty stomach or mild gastritis. Try feeding smaller, more frequent meals. If vomiting continues or becomes frequent, consult a veterinarian to rule out underlying issues."
"My cat vomited a hairball, but seems fine afterwards.","Common occurrence. Consider a hairball remedy paste or a hairball control diet. Increase daily brushing to reduce fur ingestion. If hairballs are frequent, consult a vet."
"My cat is vomiting, seems lethargic, and refuses to eat.","Possible serious underlying illness, blockage, or severe dehydration. Ensure access to water. Seek immediate veterinary attention for diagnosis and fluid therapy."
"I found a foreign object like string or a toy in my cat's vomit.","If you suspect your cat ingested a foreign object, even if they've vomited some, seek immediate veterinary attention. There could be more or internal damage. Do not induce further vomiting."
"My cat is vomiting and has a fever.","Suggests an infection, inflammation, or more serious illness. Ensure hydration. A vet visit is necessary for diagnosis and appropriate treatment (e.g., antibiotics, anti-nausea medication)."
"My cat's vomit contains fresh red blood or looks like coffee grounds.","Highly indicative of internal bleeding. This is a **medical emergency**. Rush your cat to the nearest emergency veterinarian immediately."
"My cat is vomiting and seems to be in pain, especially when her abdomen is touched.","Possible pancreatitis, foreign body, or severe gastrointestinal issue. Avoid pressing on the abdomen. Seek immediate veterinary attention for diagnosis and pain relief."
"My cat is vomiting and losing weight, even though she is eating somewhat.","Chronic vomiting and weight loss are concerning signs of a persistent underlying health problem (e.g., IBD, kidney disease). A vet visit is crucial for diagnosis and long-term management."
"My cat vomited after a change in diet or trying new food.","Likely dietary upset. Revert to the old food or introduce new food much more gradually. Withhold food for 12 hours. If vomiting persists, consult a vet."
"My cat is vomiting, but also showing signs of excessive thirst and urination.","Could indicate kidney disease, diabetes, or hyperthyroidism. A vet visit is crucial for blood work and urinalysis to diagnose the underlying condition."
"My cat is retching and gagging, but no vomit is produced, and she seems distressed.","While often a hairball, this can be a sign of a blockage or severe nausea. Offer hairball paste. If distress continues or cat is hunching, seek veterinary attention."
"My cat seems constipated and is also occasionally vomiting.","Vomiting with constipation can indicate an intestinal blockage, often from hairballs or foreign objects. Seek veterinary attention if both symptoms persist and no stool is passed."
"My cat vomited digested food a few hours after eating, then seems fine.","Could be a slow gastric emptying or mild indigestion. Offer smaller, more frequent meals. If it becomes a regular occurrence, a vet can investigate."
"My cat is vomiting, and I suspect she might have eaten a toxic plant or substance.","If you suspect poisoning, identify the substance if possible and contact your veterinarian or a pet poison control center immediately. Do NOT induce vomiting unless instructed by a professional."
"My cat is older, and has recently started vomiting more frequently, even if still eating.","New or increased vomiting in senior cats can indicate serious age-related diseases (e.g., kidney, liver, thyroid). A comprehensive vet check-up is highly recommended."
"My cat has vomited a roundworm or tapeworm.","Confirms a heavy parasitic burden. Collect the worm if possible. Administer a vet-prescribed dewormer immediately. Ensure thorough cleaning of litter box and environment."
"My cat is vomiting clear liquid frequently and seems very weak.","Indicates severe nausea and dehydration. Ensure constant access to water. Seek urgent veterinary attention for anti-nausea medication and fluid support."
"My puppy is extremely lethargic, won't eat, and has a high fever.","These are early signs of Parvovirus. This is a medical emergency. Isolate your puppy from other dogs immediately and contact your veterinarian for urgent assessment and treatment. Do not delay."
"My dog is vomiting profusely and has severe, bloody diarrhea with a distinct foul odor.","Strongly indicative of Parvovirus. This is a life-threatening situation due to rapid dehydration and systemic infection. Seek immediate emergency veterinary attention. Inform the clinic of suspected Parvo before arrival."
"My unvaccinated puppy suddenly collapsed and is very weak, with pale gums.","Highly suspicious for severe Parvovirus with shock. This requires immediate emergency veterinary care. Keep your puppy warm and handle gently. Prognosis is poor without aggressive treatment."
"My dog has watery diarrhea, is constantly vomiting, and shows signs of severe abdominal pain.","Possible Parvovirus. Abdominal pain, vomiting, and diarrhea lead to rapid dehydration. This requires urgent veterinary intervention for fluid therapy, pain management, and anti-nausea medication."
"My puppy won't drink water, is constantly throwing up, and seems to be losing weight rapidly.","These are critical signs of dehydration and severe gastrointestinal distress, common with Parvovirus. Immediate veterinary hospitalization is required for IV fluids and supportive care."
"My dog, who hasn't completed his vaccinations, is showing depression, loss of appetite, and then started vomiting.","Early progression of Parvovirus. The virus attacks the immune system, making dogs very susceptible. Isolate your dog. Contact your vet immediately for testing and aggressive treatment."
"My puppy's stool is black and tarry, and he's also vomiting.","This indicates digested blood, a severe complication of Parvovirus affecting the intestinal lining. This is a medical emergency. Rush your puppy to the vet immediately."
"My dog is shivering uncontrollably, seems disoriented, and has severe diarrhea.","Signs of shock and severe illness from Parvovirus. Keep your dog warm. Seek immediate emergency veterinary attention. Do not attempt home remedies."
